{
  "$schema": "https://json-schema.org/draft/2020-12/schema",
  "$id": "https://b46.local/contracts/inventory/v1/inventory-items-unavailable.schema.json",
  "title": "InventoryItemsUnavailable",
  "type": "object",
  "additionalProperties": false,
  "required": ["schema_version", "event_id", "operation_id", "order_id", "result", "occurred_at", "items"],
  "properties": {
    "schema_version": { "type": "string", "const": "1.0" },
    "event_id": { "type": "string", "format": "uuid" },
    "operation_id": { "type": "string", "format": "uuid" },
    "order_id": { "type": "string", "format": "uuid" },
    "result": { "type": "string", "const": "ITEMS_UNAVAILABLE" },
    "occurred_at": { "type": "string", "format": "date-time" },
    "items": {
      "type": "array",
      "minItems": 1,
      "items": {
        "type": "object",
        "additionalProperties": false,
        "required": ["order_line_id", "product_id", "requested_quantity", "available_quantity"],
        "properties": {
          "order_line_id": { "type": "string", "format": "uuid" },
		  "product_id": { "type": "string", "format": "uuid" },
          "requested_quantity": { "type": "integer", "minimum": 1 },
          "available_quantity": { "type": "integer", "minimum": 0 }
        }
      }
    }
  }
}
